,genre,artist,song,lyrics,wordcount,nostopwordcount,positivewordcount,negativewordcount,neutralwordcount
287,Hip Hop/Rap,Wu-Tang Clan,C.R.E.A.M.,what that nigga want god word up look out for the cops wutang five finger shit cash rules word up two for fives over here baby word up two for fives them niggas got garbage down the way word up know what i'm sayin' cash rules everything around me cream get yeah check this ol' fly shit out word up cash rules everything around me take you on a natural joint cream get the money here we here we go dolla dolla bill y'all check this shit yo i grew up on the crime side the new york times side staying alive was no jive at second hands moms bounced on old men so then we moved to shaolin land a young youth yo rockin' the gold tooth 'lo goose only way i begin to gee off was drug loot and let's start it like this son rollin' with this one and that one pullin' out gats for fun but it was just a dream for the teen who was a fiend started smokin' woolies at sixteen and running up in gates and doing hits for high stakes making my way on fire escapes no question i would speed for cracks and weed the combination made my eyes bleed no question i would flow off and try to get the dough all sticking up white boys in ball courts my life got no better same damn 'lo sweater times is ruff and tuff like leather figured out i went the wrong route so i got with a sick ass click and went all out catchin' keys from across seas rollin in mpv's every week we made forty g's yo nigga respect mine or anger the tech nine chchickpow wu from the gate now cash rules everything around me cream get the money dollar dollar bill y'all cash rules everything around me cream get the money dollar dollar bill y'all it's been twentytwo long hard years of still strugglin survival got me buggin but i'm alive on arrival i peep at the shape of the streets and stay awake to the ways of the world cause shit is deep a man with a dream with plans to make cream which failed i went to jail at the age of 15 a young buck sellin' drugs and such who never had much trying to get a clutch at what i could not could not the court played me short now i face incarceration pacin' going up state's my destination handcuffed in back of a bus forty of us life as a shorty shouldn't be so ruff but as the world turns i learned life is hell living in the world no different from a cell everyday i escape from jakes givin' chase sellin' base smokin' bones in the staircase though i don't know why i chose to smoke sess i guess that's the time when i'm not depressed but i'm still depressed and i ask what's it worth ready to give up so i seek the old earth who explained working hard may help you maintain to learn to overcome the heartaches and pain we got stickup kids corrupt cops and crack rocks and stray shots all on the block that stays hot leave it up to me while i be living proof to kick the truth to the young black youth but shorty's running wild smokin sess drinkin' beer and ain't trying to hear what i'm kickin in his ear neglected but now but yo it gots to be accepted that what that life is hectic cash rules everything around me cream get the money dollar dollar bill y'all cash rules everything around me cream get the money dollar dollar bill y'all cash rules everything around me cream get the money dollar dollar bill y'all cash rules everything around me cream get the money dollar dollar bill y'all,676,413,10,28,375
288,Hip Hop/Rap,Eminem,Stan,"my tea's gone cold i'm wondering why i got out of bed at all the morning rain clouds up my window and i can't see at all and even if i could it'd all be gray but your picture on my wall it reminds me that it's not so bad it's not so bad my tea's gone cold i'm wondering why i got out of bed at all the morning rain clouds up my window and i can't see at all and even if i could it'd all be gray but your picture on my wall it reminds me that it's not so bad it's not so bad dear slim i wrote you but you still ain't callin' i left my cell my pager and my home phone at the bottom i sent two letters back in autumn you must not have got 'em it probably was a problem at the post office or somethin' sometimes i scribble addresses too sloppy when i jot 'em but anyways fuck it what's been up man how's your daughter my girlfriend's pregnant too i'm out to be a father if i have a daughter guess what i'm a call her i'm a name her bonnie i read about your uncle ronnie too i'm sorry i had a friend kill himself over some bitch who didn't want him i know you probably hear this everyday but i'm your biggest fan i even got the underground shit that you did with scam i got a room full of your posters and your pictures man i like the shit you did with ruckus too that shit was fat anyways i hope you get this man hit me back just to chat truly yours your biggest fan this is stan my tea's gone cold i'm wondering why i got out of bed at all the morning rain clouds up my window and i can't see at all and even if i could it'd all be gray but your picture on my wall it reminds me that it's not so bad it's not so bad dear slim you still ain't called or wrote i hope you have the chance i ain't mad i just think it's fucked up you don't answer fans if you didn't want to talk to me outside the concert you didn't have to but you could've signed an autograph for matthew that's my little brother man he's only 6 years old we waited in the blistering cold for you for 4 hours and you just said ""no"" that's pretty shitty man you're like his fuckin' idol he wants to be just like you man he likes you more than i do i ain't that mad though i just don't like bein' lied to remember when we met in denver you said if i write to you you would write back see i'm just like you in a way i never knew my father neither he used to always cheat on my mom and beat her i can relate to what you're sayin' in your songs so when i have a shitty day i drift away and put 'em on cause i don't really got shit else so that shit helps when i'm depressed i even got a tattoo with your name across the chest sometimes i even cut myself to see how much it bleeds it's like adrenaline the pain is such a sudden rush for me see everything you say is real and i respect you 'cause you tell it my girlfriend's jealous 'cause i talk about you 24/7 but she don't know you like i know you slim no one does she don't know what it was like for people like us growing up you've gotta call me man i'll be the biggest fan you'll ever lose sincerely yours stan ps we should be together too my tea's gone cold i'm wondering why i got out of bed at all the morning rain clouds up my window and i can't see at all and even if i could it'd all be gray but your picture on my wall it reminds me that it's not so bad it's not so bad dear mister i'm too good to call or write my fans this'll be the last package i ever send your ass it's been six months and still no word i don't deserve it i know you got my last two letters i wrote the addresses on 'em perfect so this is my cassette i'm s you i hope you hear it i'm in the car right now i'm doing 90 on the freeway hey slim i drink a fifth of vodka ya dare me to drive you know this song by phil collins 'from the air in the night' about that guy who could have saved that other guy from drowning but didn't then phil saw it all then at his show he found him that's kinda how this is you could have rescued me from drowning now it's too late i'm on a thousand downers now i'm drowsy and all i wanted was a lousy letter or a call i hope you know i ripped all your pictures off the wall i loved you slim we could have been together think about it you ruined it now i hope you can't sleep and you dream about it and when you dream i hope you can't sleep and you scream about it i hope your conscious eats at you and you can't breathe without me see slim ""shut up bitch i'm trying to talk"" hey slim that's my girlfriend screaming in the trunk but i didn't slit her throat i just tied her up see i ain't like you 'cause if she suffocates she'll suffer more and then she'll die too well gotta go i'm almost at the bridge now oh shit i forgot how am i supposed to send this shit out my tea's gone cold i'm wondering why i got out of bed at all the morning rain clouds up my window and i can't see at all and even if i could it'd all be gray but your picture on my wall it reminds me that it's not so bad it's not so bad dear stan i meant to write you sooner but i've just been busy you said your girlfriend's pregnant now how far along is she look i'm really flattered you would call your daughter that and here's an autograph for your brother i wrote it on your starter cap i'm sorry i didn't see you at the show i must have missed you don't think i did that shit intentionally just to diss you and what's this shit you said about you like to cut your wrist too i say that shit just clownin' dawg c'mon how fucked up is you you got some issues stan i think you need some counselin'' to help your ass from bouncin' off the walls when you get down some and what's this shit about us meant to be together that type of shit'll make me not want us to meet each other i really think you and your girlfriend need each other or maybe you just need to treat her better i hope you get to read this letter i just hope it reaches you in time before you hurt yourself i think that you'll be doin' just fine if you'd relax a little i'm glad i inspire you but stan why are you so mad try to understand that i do want you as a fan i just don't want you to do some crazy shit i seen this one shit on the news a couple weeks ago that made me sick some dude was drunk and drove his car over a bridge and had his girlfriend in the trunk and she was pregnant with his kid and in the car they found a tape but it didn't say who it was to come to think about it his name was it was you damn",1464,686,27,67,592
289,Hip Hop/Rap,Missy Elliott,Get Ur Freak On,hit me hit me gimme some new shit gimme some new shit gimme some new shit gimme some new shit missy be puttin it down im the hottest round ill told yall mutha skurt yall can stop me now listen to me now im lastin twenty rounds and if you want me nigga then come and get me now bounce is you with me now bounce the biggie biggie bounce bounce i kno you dig the way i swsw switched ma style holla people sing around now people gather round now people jump around getcho freak ongo getcho freak ongo getcho freak ongo getcho freak ongo getcho freak ongo getcho freak ongo getcha getcha getcha getcha getcha freak on who's that bitch people you know me and timbaland been hot since twenty years ago what da dilly yo now what da drilly yo if you wanna battle me then nigga lemme know holla got the feeling son lemme throw you some people here i come now sweat me when im done we got the radio slike we got a gun getcho freak ongo getcho freak ongo getcho freak ongo getcho freak ongo getcho freak ongo getcho freak ongo getcha getcha getcha getcha getcha freak on quiet shh hush yo mouth silence when i spit it out in yo face open yo mouth give you a taste holla aint no stoppin me copywritten so dont copy me yall do it sloppily and yall cant come close to me yes i know you feel me now yes i know you hear me loud yes i scream it loud and proud yes missy gon blow it down yes people gon play me now yes in and outa town yes cuz im the best around yes with the crazy style go getcho freak ongo getcho freak ongo getcho freak ongo getcho freak ongo getcho freak ongo getcho freak ongo getcha getcha getcha getcha getcha freak on,330,224,5,32,187
290,Hip Hop/Rap,ICE-T,Colors,yo ease let's do this colors colors colors colors colors colors colors colors colors colors colors i am a nightmare walking psychopath talking king of my jungle just a gangster stalking living life like a firecracker quick is my fuse then dead as a deathpack the colors i choose red or blue cuz or blood it just don't matter sucker die for your life when my shotgun scatters colors we gangs of la will never die just multiply colors colors colors colors colors colors colors colors colors colors colors colors colors colors colors colors colors colors colors colors colors colors colors colors you don't know me fool you disown me cool i don't need your assistance social persistence any problem i got i just put my fist in colors my life is violent but violent is life peace is a dream reality is a knife my colors my honor my colors my all with my colors upon me one soldier stands tall tell me what have you left me what have i got last night in cold blood my young brother got shot my homeboy got jacked my mother's on crack my sister can't work cause her arms show trax madness insanity live in profanity then some punk claimin' they understandin' me give me a break what world do you live in death is my sect guess my religion colors colors colors colors colors colors colors colors colors colors colors colors colors colors colors colors colors colors colors colors colors colors colors colors my pants are saggin' braided hair suckers stare but i don't care my game ain't knowledge my game's fear i've no remorse so squares beware but my true mission is just revenge you ain't in my sect you ain't my friend wear the wrong color your life could end homicide's my favorite binge colors colors ka ka ka colors colors ka ka ka colors colors ka ka ka colors colors ka ka ka colors colors ka ka ka colors colors colors colors colors colors so i'll just walk like a giant police defiant you'll say to stop but i'll say that i can't my gangs my family its all that i have i'm a star on the walls is my autograph you don't like it so you know where you can go cause' the streets are my stage and terror's my show phsycoanalize tried diognising me why it wasn't your brother that brutally died but it was mine so let me define my territory don't cross the line don't try to act crazy cause' that shit don't phase me if you ran like a punk it wouldn't amaze me cause' my color is death though we all want peace but our war won't end till all wars cease colors colors colors colors colors colors colors colors colors colors colors colors ka ka ka colors colors ka ka ka colors colors colors colors colors ka ka ka khh colors ka ka ka colors colors colors colors colors colors colors colors colors colors colors colors colors colors khh ka ka ka colors colors ka ka ka colors colors colors colors colors colors colors colors colors colors colors colors colors colors colors colors colors ka ka ka ka ka ka colors,573,395,12,34,349
291,Hip Hop/Rap,Naughty By Nature,OPP,"army with harmony dave drop a load on 'em opp how can i explain it i'll take you frame by frame it to have y'all jumpin' shall we singin' it o is for other p is for people scratchin' temple the last p well that's not that simple it's sorta like another way to call a cat a kitten it's five little letters that are missin' here you get on occassion at the other party as a game 'n it seems i gotta start to explainin' bust it you ever had a girl and met her on a nice hello you get her name and number and then you feelin' real mellow you get home wait a day she's what you wanna know about then you call up and it's her girlfriend or her cousin's house it's not a front f to the r to the o to the n to the t it's just her boyfriend's at her house boy that's what is scary it's opp time other people's what you get it there's no room for relationship there's just room to hit it how many brothers out there know just what i'm gettin' at who thinks it's wrong 'cos i'm splittin' and cohittin' at well if you do that's opp and you're not down with it but if you don't here's your membership you down with opp yeah you know me you down with opp yeah you know me you down with opp yeah you know me who's down with opp every last homie you down with opp yeah you know me you down with opp yeah you know me you down with opp yeah you know me who's down with opp all the homies as for the ladies opp means something gifted the first two letters are the same but the last is something different it's the longest loveliest lean i call it the leanest it's another five letter word rhymin' with cleanest and meanest i won't get into that i'll do it ah sorta properly i say the last p hmm stands for property now lady here comes a kiss blow a kiss back to me now tell me exactly have you ever known a brother who have another like ah girl or wife and you just had to stop and just 'cos he look just as nice you looked at him he looked at you and you knew right away that he had someone but he was gonna be yours anyway you couldn't be seen with him at all and still you didn't care 'cos in a room behind a door no one but y'all are there when y'all are finish y'all can leave and only y'all would know and then y'all could throw the skeleton bone right in the closet door now don't be shocked 'cos if you're down i want your hands up high say ""opp"" ""opp"" i like to say with pride now when you do it do it well and make sure that it counts you're now down with a discount you down with opp yeah you know me you down with opp yeah you know me you down with opp yeah you know me who's down with opp every last lady you down with opp yeah you know me you down with opp yeah you know me you down with opp yeah you know me who's down with opp all the ladies this girl ah tried to opp me i had a girl and she knew that matter of fact my girl was partner's that had a fall out disagreement yeah an argument she tried to do me so we did it in my apartment bust it that wasn't the thing it must have been the way she hit the ceiling 'cos after that she kept on coming back and catchin' feelings i said ""let's go my girl is coming so you gotta leave"" she said ""oh no i love you treach"" i said ""now child please"" you gots to leave come grab your coat right now you gotta go i said ""now look you to the stairs and to the stairwindow this was a thing a little thing you shouldn't have put your heart 'cos you know i was opp hell from the very start"" come on come on now let me tell you what it's all about when you get down you can't go 'round runnin' off at the mouth that's rule number one in this opp establishment you keep your mouth shut and it won't get back to her or him exciting isn't it a special kinda business many of you will catch the same sorta opp is you with him or her for sure is going to admit it when opp comes damn skippy i'm with it you down with opp yeah you know me you down with opp yeah you know me you down with opp yeah you know me who's down with opp this whole party you down with opp yeah you know me you down with opp yeah you know me you down with opp yeah you know me who's down with opp this whole party break it down",943,446,19,11,416
292,Hip Hop/Rap,Digital Underground,The Humpty Dance,"all right stop whatcha doin' 'cause i'm about to ruin the image and the style that ya used to i look funny but yo i'm makin' money see so yo world i hope you're ready for me now gather round i'm the new fool in town and my sound's laid down by the underground i drink up all the hennessey ya got on ya shelf so just let me introduce myself my name is humpty pronounced with a umpty yo ladies oh how i like to funk thee and all the rappers in the top tenplease allow me to bump thee i'm steppin' tall y'all and just like humpty dumpty you're gonna fall when the stereos pump me i like to rhyme i like my beats funky i'm spunky i like my oatmeal lumpy i'm sick wit dis straight gangsta mack but sometimes i get ridiculous i'll eat up all your crackers and your licorice hey yo fat girl c'mereare ya ticklish yeah i called ya fat look at me i'm skinny it never stopped me from gettin' busy i'm a freak i like the girls with the boom i once got busy in a burger king bathroom i'm crazy allow me to amaze thee they say i'm ugly but it just don't faze me i'm still gettin' in the girls' pants and i even got my own dance the humpty dance is your chance to do the hump do the humpty hump come on and do the humpty hump do the humpty hump just watch me do the humpty hump do ya know what i'm doin' doin' the humpty hump do the humpty hump do the humpty hump people say ""yo humpty you're really funny lookin'"" that's all right 'cause i get things cookin' ya stare ya glare ya constantly try to compare me but ya can't get near me i give 'em more see and on the floor b all the girls they adore me oh yes ladies i'm really bein' sincere 'cause in a 69 my humpty nose will tickle ya rear my nose is big uhuh i'm not ashamed big like a pickle i'm still gettin' paid i get laid by the ladies ya know i'm in charge both how i'm livin' and my nose is large i get stoopid i shoot an arrow like cupid i use a word that don't mean nothin' like looptid i sang on doowhutchalike and if ya missed it i'm the one who said just grab 'em in the biscuits also told ya that i like to bite well yeah i guess it's obvious i also like to write all ya had to do was give humpty a chance and now i'm gonna do my dance oh yeah that's the break y'all let me hear a little bit of that bass groove right here now that i told ya a little bit about myself let me tell ya a little bit about this dance it's real easy to docheck it out first i limp to the side like my leg was broken shakin' and twitchin' kinda like i was smokin' crazy wack funky people say ya look like mc hammer on crack humpty that's all right 'cause my body's in motion it's supposed to look like a fit or a convulsion anyone can play this game this is my dance y'all humpty hump's my name no two people will do it the same ya got it down when ya appear to be in pain humpin' funkin' jumpin' jig around shakin' ya rump and when the dude a chump pump points a finger like a stump tell him step off i'm doin' the hump black people do the humpty hump do the humpty hump white people do the humpty hump do the humpty hump puerto ricans do the humpty hump just keep on doin' the hump samoans do the humpty hump do the humpty hump once again the underground is in the house i'd like to send a shout out to the whole world keep on doin' the humpty dance and to the ladies peace and humptiness forever",752,443,31,29,383
293,Hip Hop/Rap,Beastie Boys,"Hold It Now, Hit It!",hold it now hit it yo leroy aw yeah yo yo yeah why don't you do that def jam right about now now i chill real ill when i start to chill when i fill my pockets with a knot of dollar bills sippin' pints of ale out the window sill when i get my fill i'm chilly chill and now i just got home because i'm out on bail what's the time it's time to buy ale peter eater parkin' meter all of the time if i run out of ale it's thunderbird wine miller drinkin' chicken eatin' dress so fly i got friends in high places that are keepin' me high get down with mike d and it ain't no hassle i got the ladies of the eighties from here to white castle hold it now hit it yo leroy it's my joint it's my hold it now it's my rhyme the now and t adam yauch in the place to be and all the girls are on me 'cause i'm down with mike d i'm down with mike d and he ain't no baloney for real not phony oe and ricearoni i come out at night 'cause i sleep all day well i'm the king ad rock and he's mca well i'm acruisin' i'm bruisin' i'm never ever losin' i'm in my car i'm goin' far and dust is what i'm usin' around the way is where i'm from and i'm from manhattan and i'm not a bum because you're pudslappin' ballflappin' got that juice my name's mike d and i can do that jerry lewis hold it now hit it yo leroy yo man that was real def man try that again man i like that def stuff boy hip hoppin' body rockin' doin' the do beer drinkin' breath stinkin' sniffin' glue belly fillin' always illin' bustin' caps my name's mike d and i write my own snaps now i'm a peepshow seekin' on the fortydeuce i'm a killer at large and i'm on the loose pistol packin' monkey drinkin' no money bum i come from brooklyn 'cause that's where i'm from cheap skate perpetratin' money hungry jerk every day i drink oe and i don't go to work you drippy nose knucklehead you're we behind the ears you like men and we like beers yo leroy pass that joint on over yo man pass that over here man all right king of the ave with the def female you're rhymin' and stealin' with the freshest ale coolin' at the crib watchin' my tv ed norton ted knight and mr ed pump it up homeboy just don't stop chef boyardee coolin' on the pot i take no slack 'cause i got the knack and i'm never dustin' out 'cause i torch that crack the king ad rock that is my name y'all's drinkin' moet and we got the champagne a quarter droppin' goin' shoppin' buyin' wigs surgeon general cut professor dj thigs hold it now hit it hit it hold it now hit it yo leroy,584,339,9,17,313
