,genre,artist,song,lyrics,wordcount,nostopwordcount,positivewordcount,negativewordcount,neutralwordcount
341,Hip Hop/Rap,J.J. Fad,Supersonic,we're jj fad and we're here to rock rhymes like ours could never be stopped see there's three of us and i know we're fresh party rockers nonstoppers and our names are def see the 'j' is for just the other for jammin' the 'f' is for fresh 'a' and 'd' def behind the turntables is dj train mixin' and scratchin' is the name of the game now here's a little somethin' 'bout nosy people it's not real hard it's plain and simple babyd supersonic supersonic supersonic motivating rhymes are creating and everybody knows that jj fad is devastating we know you like us girls so you better get stirl 'cause we are the homechicks that are rockin' your world supersonic supersonic supersonic is a word when people start to listen especially bigger people they pay close attention you might not believe it you might not even buy it but when it comes to our lady beat box you might even try it supersonic supersonic now all you supersonic people try to bite our rhyme you may think that you are def but you're way ssso behind you better listen good to what we have to say 'cause when it comes to jj fad you can get no play supersonic supersonic now he's the freshest dj from coast to coast my man can cut and scratch but i don't mean to boast he may be a little light but that's okay 'cause when he cuts to the beat it sounds this way hit it supersonic supersonic uh uh uh yeah it's finally my turn to rock the mic because my devastating beats i know you will like you see my beat box is fresh it'll blow your mind and if you don't like my beats i'll go big in your behind hahahahahahauhuhha supersonic supersonic now you party people know what supersonic means we didn't try to brag 'cause jj fad is just too clean now baby don't you know that our rhymes are so bionic don't listen too hard don't be supersonic supersonic supersonic you see the 's' is for super and the 'u' is for unique the 'p' is for perfection and you know that we are freaks the 'e' is for exotic and the 'r' is for raps so tell those nosy people just to stay the hell back supersonic them big everlasting ears supersonic they can hear what i say faster than i can say it supersonic they better chill rock box it's like it's like she's supersonic you ran out of words hit it babyd i'm lightskinned devastatin' i know one thing he is heavy that's right'cause doll i'll take i'll take your man and you made him always rappin' always clappin' everybody always say i'm happy if you try to hang with me you should finally truly see i'm always rockin' never stoppin' devastatin' rappin' lady when i'm on the microphone it's either everybody say i'm different there's no other angel lover everybody know i'm covered clientele is a pearl everybody know in jail to the beat so you can tell everybody know your cell a sama lama lama lama doo ma see ma nama lama doo ma lama nama see ma na ma lama doo ma lama see ma lama see ma doo ma humma yeah yeah that's it that's it supersonic yeah that was it supersonic yeah that was it supersonsupersonsuper supersonic motivating supersonsupersonsuper rockin' your world supersonsupersonsuper supersonic motivating supersonic motivating rockin' your world eenie meenie disaleenie ooh wah bop a leenie asa cotcha liberace i love you take a peach take a plum take a piece of bubble gum no peach no plumb no piece of supersonic bigbigbig everlasting bigbigbigbig everlasting ears supersonic but that's o but that's o but that's okay butbutbut that's o but that's o but that's okay supersonic supersonic eenie meenie disaleenie ooh wah bop a leenie asa cotcha liberace i love you take a peach take a plum take a piece of bubble gum no peach no plumb no piece of supersonic sama lama lama lama big big super sama lama lama lama doo ma big everlasting ears supersonic jj fad jj fad supersonic jj fad jj fad is devastating supersonic susususususupersonic susususususupersonic susususususupersonic susususususuper susususususuper susususususuper susususususuper susususususupersonic ssso ssso supersonic ssso big everlasting ears eenie meenie disaleenie ooh wah bop a leenie asa cotcha liberace i love you take a peach take a plum take a piece of bubble gum no peach no plumb no piece of supersonic supersonic supersonic supersonic rockin' your world supersonic supersonic motivating,835,516,36,11,469
342,Hip Hop/Rap,Black Sheep,The Choice Is Yours,here they come yo here they come this or that repeats over who's the black sheep what's the black sheep know not who i am or when i'm coming so you sleep wasn't in my realm or wasn't in your sphere knew not who i was but listen here dres dres yes i guess i can start if it's all right with you i'll rip this here joint apart back middle to the front don't front wanna a good time gonna give you what you want can i hear a hey hey can i get a yo yo you got a 'hat huh it's for the hoes oh the styling is creative black sheep of the native can't be violated or even decepticated i got brothers in the jungle cousins on the quest dead departed uncles in pea porridge may they rest guess which way what when how mista lawnge dres black sheep slam now know you've heard the others phonies to the lovers then of course the choice is yours you can get with this or you can get with that you can get with this or you can get with that you can get with this or you can get with that i think you'll get with this for this is where it's at you can get with this or you can get with that you can get with this or you can get with that you can get with this or you can get with that i think you'll get with this for this is kinda phat where's the black sheep here's the black sheep even if we wanted to the flock could not be weak watch me swing like this why should i swing it like that because in fact on me it might not attract therefore i ignore do as i feel inside i live with me i've got my back tonight ya know what i'm saying yo black i'm not playing need to go with this or go with this with no delay and see in actuality one be can it be i made it look easy because it is to me any time capacity was filled tried to rock it any time a honey gave us play tried to knock it never was a fool so we finished school never see us sweat and you'll never see us drool out to rock the globe while it's still here to rock don't punch girls and we don't punch a clock gotta go gotta go see you later by the cat and you can't beat that with a bat you can get with this or you can get with that you can get with this or you can get with that you can get with this or you can get with that i think you'll get with this for this is where it's at you can get with this or you can get with that you can get with this or you can get with that you can get with this or you can get with that i think you'll get with this for this is kinda phat engine engine number nine on the new york transit line if my train goes off the track pick it up pick it up pick it up back on the scene crispy n' clean you can try but then why cause you can't intervene we be the outcast down for the settle won't play the rock won't play the pebble open the door you best believe we're sliding through it sssswiftly niftily we can make it hip to be what we are cause what we be be the epitome doo dah dipitty so now i dwell just to say you're plainer hold your cup cause i got the container pass a plater cross the fader black sheep get play like the sony innovator never the traitor party inflater and you can get a scoop later you can get with this or you can get with that you can get with this or you can get with that you can get with this or you can get with that i think you'll get with this for this is where it's at you can get with this or you can get with that you can get with this or you can get with that you can get with this or you can get with that i think you'll get with this for this is kinda phat,786,329,9,11,309
343,Hip Hop/Rap,EPMD,You Gots to Chill,you gots to chill relax your mind let your conscience be free and get down to the sounds of epmd oh you should keep quiet while the mc rap but if you're tired then go take a nap or stay awake and watch the show i take because right now i'm 'bout to shake an' bake the e r i c k is my name i spell things to the clientele yo i rock well i'm not an mc who' talkin' all that junk about who can beat who soundin' like a punk i just get down and i go for mine say check 12 and run down a line to the average mc i'm known as 'the terminator' funky beat maker new jack exterminator destroyin' a ploy when your rhymes are not void never sweatin' your girl why p 'cause she's a skeezoid when i'm on the scene i always rock the spot i grab the steel with the crown on the top in the beginnin' i like to let my rhymes flow and at twelve i press cruise control sit back and relax let my rhymes tax maintain mc's while the double e macks always calm under pressure no need to act ill listen when i tell you boy you gots to chill i be the personal computer information on rap like the biz markie says i'll make your toes tap i format the rhymes step by step make 'em sound deaf to maintain my rep prepared to come off in case of a diss not worried about a thing 'cause we can do this i can turn the party out just by standin' still make the ladies scream and shout while the brothers act ill take total control of your body and soul pack a nine in my pants for when it's time to roll i'm the p e e m d e e and one thing i hate is a bitin' mc when i enter the party suckers always form a line then they ease their way up and try to bite my lines i did thousands of shows dissed many faces and deal with new jacks on a onetoone basis but every now and then a sucker mc gets courageous and like an epidemic it becomes contagious but never the least they all rip for all those unaware it means rest in peace 'cause md stands for microphone doctor and the capital p capital m capital dee's no doubt the chief rocker don't like to get ill but if i have to i kill so believe me boy you gots to chill catch every word i'm sayin' no there's no delayin' don't hestitate to motivate the crowd i'm not playin' seeing is believing you catch my drift don't try to adapt because i'm just too swift how swift i'm so swift and that's an actual fact i'm like zorro i mark a e on your back i don't swing on no ropes or no iron cords the only weapon is my rappin' sword intimidate mc's with the tone of my vocal drone when i'm pushin' on the microphone 'cause i'm the funky rhyme maker mc undertaker the one who likes to max and relax and when it's time issue diggumsmacks i keep their hands clappin' fingers snappin' feet tappin' when it's time to roll uzi patrol's packin' the pee md the mic's my only friend and through the course of the party i kill again and again so if you're thinkin' 'bout battlin' you better come prepared come wit' your shield and your armoured gear you gots to chill dj la boss takes no shorts,662,372,20,26,326
344,Hip Hop/Rap,"Lil' Kim /F Lil' Cease, Notorious B.I.G.",Crush On You (Remix),lil' kim /f lil' cease notorious big miscellaneous crush on you remix intro lil' cease undeas uhh uhhuh lil' ceaser uhh uhhah queen bee uhh uhhuh that's me uhh check it lil' kim verse one lil' cease yo i be buyin em v's so all my girls be eyein cease comin backstage dyin to get pleased you got me i rock thee versace and linen while you stop your grinnin wit bunch of foxy women why you speed ball with cards that's invalid i get clothes custom made from a stylist cruise in my lexus land with no mileage while you walk the street until your feet get calloused take you on a natural high like a pilot it be all good toss your clothes like a salad when it's all over put your vote in my ballot it's my diner i'm mel and you're alice spend a night in lil' cease palace it be all good as long as you don't act childish while you standin there with the crist' in your cup if worse come to worse keep this on the hush uhh     hook notorious big i know you seen me on the video true i know you heard me on the radio true but you still don't pay me no attention listenin to what your girlfriends mention he's a slut he's a hoe he's a freak got a different girl every day of the week it's cool not tryin to put a rush on you i had to let you know that i got a crush on you verse two lil' kim aiyyo shorty won't you go get a bag of the lethal i'll be undressed in the bra all see through while you count your jewels thinkin i'ma cheat you the only one thing i wanna do is freak you keep your stone sets i got my own baguettes and i'll be doin things that you won't regret lil kim the queen bee so you best take heed shall i proceed yes indeed i'ma throw shade if i can't get paid blow you up to your girl like the army grenade you can slide on my ice like the escapade and itchygitchyyaya with the marmalade who me not you oh yes who's he i even dig yo' man's style but i love yo' profile whisper in your ear and get you all shook up but don't blush just keep this on the hush     hook verse three lil' cease lil' kim while you tryin to catch sea breeze i'm in the pv's all chrome d3's decked out tv's cd's with crazy bass keep my lady laced don't be fooled by the baby face i hope ya not cause your thighs got me hot only one plan that's to rise to the top i told you before when i first pursued i want a interlude in the nude you know i love the way you feela sip my tequila works from the dealers all in chinchila heat up the clutch sevenfifty deluxe then we speed down the hutch breakin trees in the dutch i'm not the one you sleep wit to eat quick want a cheap trick better go down to freaknik you got to hit me off buy this girl gifts of course so i look slick in my six with my christian lacroix     hook 4x to fade,604,345,17,21,307
345,Hip Hop/Rap,Pete Rock and CL Smooth,They Reminisce Over You (T.R.O.Y.),i reminisce i reminisce i reminisce i reminisce i reminisce i reminisce i reminisce i reminisce uh i reminisce i reminisce yeah i reminisce i reminisce i reminisce i reminisce i reminisce i reminisce i reminisce for a spell or shall i say think back 22 years ago to keep it on track the birth of a child on the 8th of october a toast but my granddaddy came sober countin all the fingers and the toes now i suppose you hope the little black boy grows huh 18 years younger than my mama but i really got beatings cause the girl loved drama in single parenthood there i stood by the time she was 21 had another one this one's a girl let's name her pam same father as the first but you don't give a damn irresponsible plain not thinking papa said chill but the brother keep winking still he won't down you or tear out your hide on your side while the baby maker slide but mama got wise to the game the youngest of five kids hon here it is after 10 years without no spouse momma's gettin married in the house listen positive over negative for the women and master mother queen's risin a chapter deja vu tell you what i'm gonna do when they reminisce over you my god my god it's so yeah so lovely that's how we like to do it in the 90's pete rock and cl smooth comin' atcha when i date back i recall a man off the family tree my right hand poppa doc i see took me from a boy to a man so i always had a father when my biological didn't bother taking care of this so who am i to bicker not a bad ticker but i'm clocking pop's liver but you can never say that his life is through 5 kids at 21 believe he got a right too here we go while i check the scene with the portuguese lover at the age of 14 the same age front page no fuss but i bet you all your dough they live longer than us never been senile that's where you're wrong but give the man a taste and he's gone noddin off sleep to a jazz tune i can hear his head banging on the wall in the next room i get the pillow and hope i don't wake him for this man do cuss hear it all in verbatim telling me how to raise my boy unless he's taking over i said pop maybe when you're older we laughed all night about the hookers at the party my old man standing yelling good god almighty use your condom take sips of the brew when they reminisce over you for real for real baby like that we for real comin' atcha in '92 pete rock and cl smooth yeah c'mon hit me i reminisce so you never forget this the days of way back so many bear witness the fitness take the first letter out of each word in this joint listen close as i prove my point t to the ruhoy how did you and i meet in front of big lou's fighting in the street but only you saw what took many time to see i dedicate this to you for believing in me rain or shine yes in any weather my grand mom pam holds the family together my uncle doc's the greatest better yet the latest if we're talking about a car uncle sterling got the latest i strive to be live 'cause i got no choice and run my own business like my aunt joyce so pete rock hit me nuff respect due when they reminisce over you listen listen just listen to the funky song as i rock on and that's word is bond i'm not playin everybody just coolin this song we dedicate to the one and only never be another he was my brother trouble troy it's like that y'all and you don't stop pete rock and cl smooth for '92 and we out later,720,379,21,14,344
346,Hip Hop/Rap,CAM'RON,Oh Boy,cam'ron just blaze oh baby oh baby uh killa cam'ron all the girls see the boy look at his kicks boy look at his car boy all i say is oh boy look mami i'm no good i'm so hood clap at your soldiers sober then leave after it's over killa i'm not your companion or your man standin' hit me when you wanna get rammed in i'll be scramblin' with lot's of mobsters shop for lobsters cops and robbers listen every block is blocka blocka but she like the way i diddy bop you peeped that mink on maury kicks plus chanel ski hat she want the boy so i give her the boy now she screamin' out boy boy boy boy now she playin' with herself cam dig it out lift her up ma it's just a fuck girl get it out pick one up they want the boy montana with guns with bandanas listen to my homeboy santana juelz santana y'all niggas can't fuck with the boy i'm tellin' ya boy put a shell in ya boy now he bleedin' oh boy get him call his boy he weezin' he need his boy he screamin' boy boy boy boy damn shut up boy he's snitchin' oh boy this nigga's bitchin' boy he's twistin' oh boy if feds was listenin' boy damn whoa damn i'm in trouble need bail money shit where the fuck is my boy i got trust for my boy that's why i buck with my boy that's my nigga oh boy he 'gon come get his boy he got love for his boy that's my yeah yeah yeah yeah cam'ron when he got caught with the boy we went to court for the boy just me and my boy and we sayin' oh boy be on the block with my boy with the roc fella boy when the cops come squalin' yeah this is for the sports cars benitas jimmy's pj's old school eighteenth at the sports bar eight or nine on the boy holla at your boy killa holla listen it's the dip boy plus the roc boy you'll be doa boy your moms will say oh boy shit ain't no stoppin' 'em guns we got alot of 'em matter fact gurus start poppin' 'em then slap up his boy clap up his boy wrap up his boy get them gats oh boy diplomats are them boy for the girls and the boy say yeah yeah yeah yeah juelz santana now when they see cam and his boy they say damn oh boy santana's that boy that squeeze hammers oh boy canons and bandanas glammers we don't brandish blam at your man's canvas then scram with your man's leaded and i'm back with my boy cam'ron until that man is vanished somewhere in the grand canyon these kids are grand standin' niggas demand ransom over them grands scramblin' boy boy boy boy well fuck it van damme 'em cam a blam blam 'em call up his boy i'm down south tannin' mami i got the remedy tommys up at the enemy hire me somebody but now my body you're feelin' fanicky killa and coppa we chill in morocco for reela we got what you chill it though and fill with them hollows huh it's the boy i said it's the boy i'm the yeah yeah yeah yeah killa,617,380,9,16,355
347,Hip Hop/Rap,The Jungle Brothers,What 'U' Waiting For?,"the jungle brothers miscellaneous what 'u' waiting for come on jump up freak a hustle do what you want but move every muscle ain't no time for playing around only one thing to do when you hear this sound act yourself with someone else and make sure yourself ain't by yourself  dyin' to get on the dance floor girl what you waiting for come on over and swing with me take your mind out yo' misery tomorrow's gonna be another day tonight i'm gonna take it life grab the world and put it on hold relax my body and rest my soul feel the vibe surrounding me feel the bass come down on me  shake your butt but don't break your back tap your feet and let your fingers snap no matter what size shape or colour we can jam and enjoy each other music's pumpin' i feel something must be my blood and h eartbeat thumpin dispense your funds to pass through the door you know there's room for you on the floor you don't know if they'll be any more so yo what you waiting for  chanting in background ""waiting the timeless time""  yeah yeah some playin' a wall i wasn't with that not livin' like that you ain't with it let me hear you say ho you ain't with it let me hear you say aaaaoooo aaaooo ready to boogie i had on my dancin' shoes ain't in the mood to be singing no blues so if you want to be a little disco ducka i came here tonight to so good morning good afternoon good night don't let the bedbugs bite going way out when i'm aiming to please you havin' a good time climb up my trees c'mon what you waiting for c'mon what you waiting for  ""waiting the timeless time""  side to side and just let it ride give what you got no need to hide you're allowed as long as your able take away the chairs and move away the tables i'm doing my thing working around you ladies screaming we wanna house you we won't say much on this no now cause i'm not quite sure that you know how but keep on dancin' keep on dancing baby on not clockin' you i'm just glancin' and what i see now is a fine figure8 don't make me wait  yeah waiting for the dj to play my song o lord i must have waited all night long the joint was packed and it looked like a jungle i felt at home there goes my song s o i hit the floor and jumped on the case sweat pouring from my face clothes was wet by i didn't care you know what i'm saying i know what you're sayin'  so come on girl come on girl come on let's let's let's get it on i'm dyin' to get out on the floor i waited long enough; i can't wait no more come on girl come on girl come on let's let's let's get it on i'm dyin' to get out on the floor i waited long enough; i can't wait no more  yeah uh uh yeah uh yeah etc",593,331,11,6,314
348,Hip Hop/Rap,Wyclef Jean Feat. The Refugee Allstars,We Trying To Stay Alive,we got the refugees all stars rubba dubbing in the club wyclef jean john forte prizewell nah mean the streets are getting a little crazy looka looka looka looka looka looka looka looka here looka shorty got back should i ask her for a dance hold on there's too many in a wolf pack and besides dirtycash talking to her buying her fake furs and taking her to the fever quite as his kept that ain't even his benz she spends his franklins at the malls with her friends 'material girl' living in a material world but it's alright 'cause it's saturday night so mista funkmaster pump the bee gees and all you college students bring your ouijas check the spelling r e f u g e e get the cd from sam goody he he you ain't even close wit the rhymes that you wrote don't be mad 'cause you broke let me clear my throat john forte grab the mic roots sway it this way i more than just a rhymer you still a small timer hoping that the game treat that ass a little kinda every step tango'd your beat don't concern me i'm eating mangoes in trinidad wit attorneys oh yeah my crews slang flow worldwide like a current wit da every spot where nobody get insurance brotha do the math you ain't half near exotic my man's claim true you forget about it pope hoe just a new stance like my influence well recognize you a lie trying do it got juice told your lady oops we nuts baby smooth and charismatic automatic you gonna save me god bless the day that my sons survive we strive to teach the youth baby and stay alive refugee camp nuts baby john forte yo watch your lady yo watch your lady special ill rhyme dirtycash yo if you got more than dollar in your pocket right now put your hands up yo yo you can tell by the way i roll shorty that i'm a ladies man a business man condos down the shore multi million pension plans but it ain't in my plan to make move without the fam i keep it intact you 'clef do the track john play da mack while i pay the tax business as usual watching suspects steal my assets get cut with gillette's we built this concept connect like nynex drinks at the bar my american express yo i cook up cook up the cop a pull up pull up then i cuff up cuff up you who's calling bluff now you shook up shook up 'cause you lock up lock up when i love up love up you who's calling bluff hey yo john is chilling dirtycash chilling what more can i say we living that's what we got we got it good and since you understood we be yeah live at the carnival '97 'til infinite refugee all stars can't stop the shining can't stop the shining can't stop the shining can't stop the shining you wanna stop the shining you wanna stop the shining you wanna stop the shining you wanna stop the shining can't stop the shining can't stop the shining,564,352,12,8,332
