,genre,artist,song,lyrics
55,Country,Lee Greenwood,God Bless the USA,if tomorrow all my things were gone i'd worked for all my life and i had to start again with just my children and my wife i'd thank my lucky stars to be livin' here today 'cause the flag still stands for freedom and they can't take that away and i'm proud to be an american where at least i know i'm free and i won't forget the men who died who gave that right to me and i gladly stand up next to you and defend her still today 'cause there ain't no doubt i love this land god bless the usa from the lakes of minnesota to the hills of tennessee across the plains of texas from sea to shining sea from detroit down to houston and new york to la well there's pride in every american heart and its time we stand and say that i'm proud to be an american where at least i know i'm free and i wont forget the men who died who gave that right to me and i gladly stand up next to you and defend her still today 'cause there ain't no doubt i love this land god bless the usa and i'm proud to be an american where at least i know i'm free and i wont forget the men who died who gave that right to me and i gladly stand up next to you and defend her still today 'cause there ain't no doubt i love this land god bless the usa
56,Country,Porter Wagoner,A Satisfied Mind,how many times have you heard someone say if i had his money i could do things my way but little they know that it's so hard to find one rich man in ten with the satisfied mind once i was wading in fortune and fame everything that i've dreamed for to get a start in life's game but suddenly it happened i lost every dime but i'm richer by far with the satisfied mind money can't buy back your youth when you're old or a friend when you're lonely or a love that's grown cold the wealthiest person is a pauper at times compared to the man with the satisfied mind when life has ended and my time has run out my friends and my loved ones i'll leave there's no doubt but there's one thing for certain when it comes my time i'll leave this old world with the satisfied mind
57,Country,Eddy Arnold,I'll Hold You In My Arms (1947),eddy arnold miscellaneous i'll hold you in my arms 1947 ill hold you in my heart till i can hold you in my arms like youve never been held before ill think of each day and then ill dream the night away till you are in my arms once more the stars up in the sky know the reason why i feel so blue when im away from you ill hold you in my heart till i can hold you in my arms so darling please wait for me the stars up in the sky know the reason why i feel so blue when im away from you ill hold you in my heart till i can hold you in my arms so darling please wait for me
58,Country,Tennessee Ernie Ford,Sixteen Tons,"some people say a man is made out of mud a poor man's made out of muscle and blood muscle and blood and skin and bones a mind that's weak and a back that's strong you load sixteen tons and whattaya get another day older and deeper in debt st peter don'cha call me 'cause i can't go i owe my soul to the company store i was born one morning when the sun didn't shine i picked up my shovel and i walked to the mine i loaded sixteen tons of number nine coal and the straw boss said ""well bless my soul"" you load sixteen tons and whattaya get another day older and deeper in debt st peter don'cha call me 'cause i can't go i owe my soul to the company store i was born one morning it was drizzlin' rain fightin' and trouble are my middle name i was raised in the cane break by an old mama lion can't no hightoned woman make me walk the line you load sixteen tons and whattaya get another day older and deeper in debt st peter don'cha call me 'cause i can't go i owe my soul to the company store if you see me comin' better step aside a lotta men didn't a lotta men died one fist of iron the other of steel if the right one don't getcha then the left one will you load sixteen tons and whattaya get another day older and deeper in debt st peter don'cha call me 'cause i can't go i owe my soul to the company store"
59,Country,Willie Nelson and Merle Haggard,Pancho and Lefty,living on the road my friend is gonna keep you free and clean now you wear your skin like iron and your breath is hard as kerosene you weren't your mama's only boy but her favourite one it seems she began to cry when you said goodbye and sank into your dreams pancho was a bandit boy his horse was fast as polished steel he wore his gun outside his pants for all the honest world to feel pancho met his match you know on the deserts down in mexico nobody heard his dying words; ah but that's the way it goes all the federales say they could have had him any day they only let him slip away out of kindness i suppose lefty he can't sing the blues all night long like he used to the dust that pancho bit down south ended up in lefty's mouth the day they laid poor pancho low lefty split for ohio where he got the bread to go there ain't nobody knows all the federales say they could have had him any day they only let him slip away out of kindness i suppose the poets tell how pancho fell and lefty's living in cheap hotels the desert's quiet cleveland's cold and so the story ends we're told pancho needs your prayers it's true but save a few for lefty too he only did what he had to do and now he's growing old all the federales say they could have had him any day they only let him go so long out of kindness i suppose a few grey federales say they could have had him any day they only let him go so long out of kindness i suppose
60,Country,Charley Pride,Kiss An Angel Good Mornin',when ever i chance to meet some old friends on the street they wonder how does a man get to feel this way i've always got a smiling face anytime and any place and every time they ask me why i just smile and say you've got to kiss an angel good morning and let her know you think about her when you're gone kiss an angel good morning and love her like the devil when you get back home well people may try to guess the secret of my happiness but some of them never learn it's a simple thing the secret that i'm speaking of is a woman and a man in love and the answer is in this song that i always sing 
61,Country,Billy Ray Cyrus,Achy Breaky Heart,you can tell the world you never was my girl you can burn my clothes when i'm gone or you can tell your friends just what a fool i've been and laugh and joke about me on the phone you can tell my arms go back onto the phone you can tell my feet to hit the floor or you can tell my lips to tell my fingertips they won't be reaching out for you no more but don't tell my heart my achy breaky heart i just don't think it'd understand and if you tell my heart my achy breaky heart he might blow up and kill this man you can tell your ma i moved to arkansas you can tell your dog to bite my leg or tell your brother cliff who's fist can tell my lips he never really liked me anyway oh tell your aunt louise tell anything you please myself already knows that i'm not okay oh you can tell my eyes to watch out for my mind it might be walking out on me today don't tell my heart my achy breaky heart i just don't think it'd understand and if you tell my heart my achy breaky heart he might blow up and kill this man don't tell my heart my achy breaky heart i just don't think it'd understand and if you tell my heart my achy breaky heart he might blow up and kill this man don't tell my heart my achy breaky heart i just don't think it'd understand and if you tell my heart my achy breaky heart he might blow up and kill this man
62,Country,Waylon Jennings,"Luckenbach,Texas (Back To The Basics Of Love)",there only two things in life that make it worth livin' that's guitars that tune good and firm feelin' women i don't need my name in the marquis lights i got my song and i got you with me tonight maybe it's time we got back to the basics of love let's go to luckenbach texas with waylon and willie and the boys this successful life we're livin' got us feuding like the hatfields and mccoys between hank williams pain songs and newberry's train songs and blue eyes cryin' in the rain out in luckenbach texas ain't nobody feelin' no pain so baby let's sell your diamond ring buy some boots and faded jeans and go away this coat and tie is choking me in your high society you cry all day we've been so busy keepin' up with the jones four car garage and we're still building on may be it's time we got back to the basics of love let's go to luckenbach texas with waylon and willie and the boys this successful life we're livin' got us feuding like the hatfields and mccoys between hank williams pain songs and newberry's train songs and blue eyes cryin' in the rain out in luckenbach texas ain't nobody feelin' no pain let's go to luckenbach texas with waylon and willie and the boys this successful life we're livin' got us feuding like the hatfields and mccoys between hank williams pain songs and jerry jeff's train songs and blue eyes cryin' in the rain out in luckenbach texas ain't nobody feelin' no pain
63,Country,Hank Snow,I've Been Everywhere,"i was totin' my pack along the dusty winnemucca road when along came a semi with a high and canvas covered load ""if you're going to winnemucca mack with me you can ride"" so i climbed into the cab and then i settled down inside he asked me if i'd seen a road with so much dust and sand and i said ""listen bud i've traveled every road in this here land""  i've been everywhere man i've been everywhere man 'cross the deserts bare man i've breathed the mountain air man of travel i've had my share man i've been everywhere been to reno chicago fargo minnesota buffalo toronto winslow sarasota wichita tulsa ottawa oklahoma tampa panama mattawa la paloma bangor baltimore salvador amarillo tocopilla barranquilla and padilla i'm a killer i've been everywhere man i've been everywhere man 'cross the deserts bare man i've breathed the mountain air man of travel i've had my share man i've been everywhere boston charleston dayton louisiana washington houston kingston texarkana monterey ferriday santa fe tallapoosa glen rock black rock little rock oskaloosa tennessee hennessey chicopee spirit lake grand lake devil's lake crater lake for pete's sake; i've been everywhere man i've been everywhere man 'cross the deserts bare man i've breathed the mountain air man of travel i've had my share man i've been everywhere louisville nashville knoxville ombabika shefferville jacksonville waterville costa rica pittsfield springfield bakersfield shreveport hackensack cadillac fond du lac davenport idaho jellicoe argentina diamontina pasadena catalina see what i mean sir; i've been everywhere man i've been everywhere man 'cross the deserts bare man i've breathed the mountain air man of travel i've had my share man i've been everywhere pittsburgh parkersburg gravellburg colorado ellensburg rexburg vicksburg eldorado larrimore atmore haverstraw chattanika chaska nebraska alaska opelika baraboo waterloo kalamazoo kansas city sioux city cedar city dodge city what a pity; i've been everywhere man i've been everywhere man 'cross the deserts bare man i've breathed the mountain air man of travel i've had my share man ""i know some place you haven't been"" i've been everywhere"""
64,Country,Hank Thompson,The Wild Side of Life,you wouldn't read my letter if i wrote you you asked me not to call you on the phone but there's something i'm wanting to tell you so i wrote it in the words of this song  i didn't know god made honky tonk angels i might have known you'd never make a wife you gave up the only one that ever loved you and went back to the wild side of life the glamour of the gay night life has lured you to the places where the wine and liquor flows where you wait to be anybody's baby and forget the truest love you'll ever know 
65,Country,Dan Seals,Bop,put on your boppin' socks baby roll up your old blue jeans theres a band playin' down at the armory knows what rock and roll really means i want to ride in your '55 tbird drive through some old memories i ain't after your body baby i just want you to dance with me i want to bop with ya baby all night long i want to bop the night away i want to make it a night like it used to be when are hearts were young and our souls were free i want to bop with you baby all night long i want to bebop with you baby till the break of dawn i want to bop with you baby all the night long i got an old photograph in my pocket when we were still in our teens the lord knows i feel a lot older now but you still look the same to me honey you don't ever laugh like you used to and i don't wanna see you blue if you ain't busy tonight and you think it's alright this is what i want to do i want to bop with you baby all night long i want to bop the night away i want to make it a night like it used to be oh when are hearts were young and our souls were free i want to bop with you baby all night long i want to bebop with you baby till the break of dawn i want to bop with you baby all the night long lets twist and shout oh just like in the good old days baby watch out you know i just can't stand it when you look at me that way i want to bop with you baby all night long i want to bebop with you baby till the break of dawn i want to bop with you baby all the night i want to bop with you baby all night long i want to bebop with you baby till the break of dawn i want to make it a night like it used to be when are hearts were young and our souls were free i want to bop with you baby all night long i want to bebop with you baby till the break of dawn i want to make it a night like it used to be when are hearts were young and free
66,Country,Jeanne Pruett,Satin Sheets,satin sheets to lie on satin pillows to cry on still i'm not happy don't you see big long cadillac tailormades upon my back still i want you to set me free i've found another man who can give more than you can though you've given me everything money can buy but your money can't hold me tight like he does on a long long night no you didn't keep me satisfied satin sheets to lie on satin pillows to cry on still i'm not happy don't you see big long cadillac tailormades upon my back still i want you to set me free satin sheets to lie on satin pillows to cry on still i'm not happy don't you see big long cadillac tailormades upon my back still i want you to set me free satin sheets to lie on satin pillows to cry on still i'm not happy don't you see big long cadillac tailormades upon my back still i want you to set me free
67,Country,Hank Williams,Love Sick Blues,i got a feelin' called the blues oh lawd since my baby said goodbye and i don't know what i'll do all i do is sit and sigh oh lawd that last long day she said goodbye well lawd i thought i would cry she'll do me she'll do you she's got that kind of lovin' lawd i love to hear her when she calls me sweet daddy such a beautiful dream i hate to think it all over i've lost my heart it seems i've grown so used to you some how well i'm nobody's sugar daddy now and i'm lonesome i got the lovesick blues well i'm in love i'm in love with a beautiful gal that's what's the matter with me well i'm in love i'm in love with a beautiful gal but she don't care about me lawd i tried and i tried to keep her satisfied but she just wouldn't stay so now that she is leavin' this is all i can say i got a feelin' called the blues oh lawd since my baby said goodbye and i don't know what i'll do all i do is sit and sigh oh lawd that last long day she said goodbye well lawd i thought i would cry she'll do me she'll do you she's got that kind of lovin' lawd i love to hear her when she calls me sweet daddy such a beautiful dream i hate to think it all over i've lost my heart it seems i've grown so used to you some how well i'm nobody's sugar daddy now and i'm lonesome i got the lovesick blues
68,Country,Red Foley,Chattanoogie Shoe Shine Boy,have you ever passed the corner of forth and grand where a little ball o' rhythm has a shoeshine stand people gather 'round and they clap their hands he's a great big bundle o' joy he pops the boogie woogie rag the chattanoogie shoeshine boy he charges you a nickel just to shine one shoe he makes the oldest kind o' leather look like new you feel as though you wanna dance when he gets through he's a great big bundle o' joy he pops the boogie woogie rag the chattanoogie shoeshine boy it's a wonder that the rag don't tear the way he makes it pop you ought to see him fan the air with his hoppityhippityhippityhoppityhoppityhippityhop he opens up for business when the clock strikes nine he likes to get up early when they're feelin' fine everybody gets a little rise 'n shine with the great big bundle o' joy he pops the boogie woogie rag the chattanoogie shoeshine boy it's a wonder that the rag don't tear the way he makes it pop just listen to him fan the air here he goes he opens up for business when the clock strikes nine he likes to get up early when they're feelin' fine everybody gets a little rise 'n shine with the great big bundle o' joy he pops the boogie woogie rag the chattanoogie shoeshine boy the chattanoogie shoeshine boy
69,Country,Bob Wills,Spanish Two Step,"down below the rio grande a senorita held my hand and sweetly sang an old melody without a worry or a care a rose she gave me from her hair and then she whispered ""si senor si"" in a cabaret we dance the hours away her eyes told more than words e'er could say i told her i had to go left her down in mexico while the band play spanish two step soft and low"
70,Country,Jim Reeves,Four Walls,four walls jim reeves out where the bright lights are glowing you're drawn like a moth to a flame you laugh while the wine's overflowing while i sit and whisper your name four walls to hear me four walls to see four walls too near me closing in on me sometimes i ask why i'm waiting but my walls have nothing to say i'm made for love not for hating so here where you left me i'll stay one night with you is like heaven and so while i'm walking the floor i listen for steps in the hallway and wait for your knock on my door four wals to hear me four wals to see four wals to near me closing in on me closing in on me
71,Country,Willie Nelson,On The Road Again,on the road again just can't wait to get on the road again the life i love is making music with my friends and i can't wait to get on the road again on the road again goin' places that i've never been seein' things that i may never see again and i can't wait to get on the road again on the road again like a band of gypsies we go down the highway we're the best of friends insisting that the world keep turning our way and our way is on the road again just can't wait to get on the road again the life i love is makin' music with my friends and i can't wait to get on the road again on the road again like a band of gypsies we go down the highway we're the best of friends insisting that the world keep turning our way and our way is on the road again just can't wait to get on the road again the life i love is makin' music with my friends and i can't wait to get on the road again and i can't wait to get on the road again
72,Country,Waylon Jennings,Good Hearted Woman,she's a goodhearted woman in love with a goodtimin' man she loves him in spite of his wicked ways she don't understand through teardrops and laughter they'll pass through this world hand in hand she's a goodhearted woman loving a goodtimin' man well a long time forgotten dreams have just fell by the way and the good life he promised ain't what she's living today but she never complains of the bad times or bad things he's done she just talks about the good times they've had and all the good times to come she's a goodhearted woman in love with a goodtimin' man she loves him in spite of his wicked ways she don't understand through teardrops and laughter they'll pass through this world hand in hand she's a goodhearted woman loving a goodtimin' man he likes the bright light the nite life and goodtimin' friends when the party's all over she'll welcome him back home again she don't understand him but she does the best that she can this goodhearted woman lovin' a goodtimin' man she's a goodhearted woman in love with a goodtimin' man she loves me in spite of my wicked ways she don't understand through teardrops and laughter they'll pass through this world hand in hand she's a goodhearted woman loving a goodtimin' man she's a goodhearted woman loving a goodtimin' man
73,Country,Keith Urban,Somebody Like You (Album Version),there's a new wind blowin' like i've never known i'm breathin' deeper than i've ever done and it sure feels good to finally feel the way i do now i wanna love somebody love somebody like you an' i'm lettin' go of all my lonely yesterdays i've forgiven myself for the mistakes i've made now there's just one thing the only thing i wanna do mmm mmm i wanna love somebody love somebody like you yeah i wanna feel the sunshine shinin' down on me and you when you put your arms around me you let me know there's nothing in this world i can't do i used to run in circles goin' nowhere fast i'd take uh one step forward and two steps back couldn't walk a straight line even if i wanted to mmm mmm i wanna love somebody love somebody like you whoa here we go now yeah i wanna feel the sunshine shinin' down on me and you when you put your arms around me well baby there ain't nothing in this world i can't do sometimes it's hard for me to understand but you're teachin' me to be a better man i don't want to take this life for granted like i used to do no no i wanna love somebody love somebody like you i'm ready to love somebody love somebody like you ooh an' i wanna love somebody love somebody like you yeah oh yeah oh i wanna be the man in the middle of the night shinin' like it's true i wanna be the man that you run to whenever i call on you when everything that loved someone finally found it's way wanna be a better man i see it in you yeah yeah yeah yeah yeah yeah yeah you wanna believe it
74,Country,Keith Whitley,When You Say Nothing at All,it's amazing how you can speak right to my heart without saying a word you can light up the dark try as i may i could never explain what i hear when you don't say a thing the smile on your face let's me know that you need me there's a truth in your eyes saying you'll never leave me a touch of your hand says you'll catch me if ever i fall now you say it best when you say nothing at all all day long i can hear people talking out loud but when you hold me near you drown out the crowd old mr webster could never define what's being said between your heart and mine the smile on your face let's me know that you need me there's a truth in your eyes saying you'll never leave me a touch of your hand says you'll catch me if ever i fall yeah you say it best when you say nothing at all the smile on your face let's me know that you need me there's a truth in your eyes saying you'll never leave me a touch of your hand says you'll catch me if ever i fall yeah you say it best when you say nothing at all
75,Country,Toby Keith,Should've Been a Cowboy,"i'll bet you've never heard ole marshall dillon say ""miss kitty have you ever thought of running away and settling down would you marry me if i ask you twice and begged you pretty please"" lord she'd have said ""yes"" in a new york minute they never tied the knot his heart wasn't in it he just stole a kiss and he rode away he never hung his brim up at kitty's place i should've been a cowboy i should've learned to rope and ride wearing my sixshooter riding my pony on a cattle drive stealing a young girl's heart yeah just like gene and roy sang a few rodeo songs yeah i should've been a cowboy i might of had a side kick with a funny name running wild through the hills chasing jesse james up on the brink of danger and riding shotgun for the texas rangers go west young man everybody knows that california is full of whiskey and women and beer and gold i don't nap beneath the desert star a dream in my eye and a prayer my heart i should've been a cowboy i should've learned to rope and ride wearing my sixshooter riding my pony on a cattle drive stealing a young girl's heart just like gene and roy i sang a few cowgirl songs i should've been a cowboy i should've been a cowboy i should've learned to rope and ride yeah wearing my sixshooter riding my pony on a cattle drive stealing a young girl's heart just like gene and roy i sang a few redneck songs yeah i should've been a cowboy i should've been a cowboy i should've learned to rope and ride wearing my sixshooter riding my pony on a cattle drive stealing a young girl's heart just like gene and roy singing a campfire song yeah i should've been a cowboy yeah cowboy should've learned to rope and ride oh wearing my sixshooter riding my pony on a cattle drive stealing a young girl's heart yeah just like gene and roy i sang a few campfire songs i should've been a cowboy what you say i said i should've been a cowboy i should've been a cowboy"
