,genre,artist,song,lyrics
76,Country,Clint Black,Killin' Time,you were the first thing that i thought of when i thought i drank you off my mind when i get lost in the liquor you're the only one i find if i did the things i oughta you still would not be mine so i'll keep a tight grip on the bottle gettin' loose and killin' time this killin' time is killin' me drinking myself blind thinkin' i won't see that if i cross that line and they bury me well i just might find i'll be killin' time for eternity i don't know nothin' 'bout tomorrow i've been lost in yesterday i've spent all my life just dying for a love that passed away there's an end to all my sorrow this is the only price i'll pay i'll be a happy man when i go and i can't wait another day this killin' time is killin' me drinking myself blind thinkin' i won't see that if i cross that line and they bury me well i just might find i'll be killin' time for eternity yes i just might find i'll be killin' time for eternity
77,Country,Roger Miller,King Of The Road,trailer for sale or rent rooms to let fifty cents no phone no pool no pets i ain't got no cigarettes ah but two hours of pushin' broom buys an eight by twelve fourbit room i'm a man of means by no means king of the road third boxcar midnight train destination bangor maine old worn out clothes and shoes i don't pay no union dues i smoke old stogies i have found short but not too big around i'm a man of means by no means king of the road i know every engineer on every train all of their children and all of their names and every handout in every town and every lock that ain't locked when no one's around i sing trailers for sale or rent rooms to let fifty cents no phone no pool no pets i ain't got no cigarettes ah but two hours of pushin' broom buys an eight by twelve fourbit room i'm a man of means by no means king of the road
78,Country,Bill Anderson,Still,still though you broke my heart still though we're far apart i love you still still after all this time still you're still on my mind i love you still i've lost count of the hours and i've lost track of the days in fact i've lost just about everything since you went away i love you still everything that is except the memories you left me and that's one things that no one can mar i don't know who you're with i don't even know where you've gone my only hope is that some day you might hear this song and you'll know i wrote it especially for you i love you still and i love you wherever you are still after all this time still you're still on my mind i love you still this flame in my heart is like an eternal fire for every day it burns hotter and every day it burns higher i love you still and i haven't been able to put out one little flicker not even with all of these tears my friends all think i'm crazy and maybe i am but i'll carry this torch just as long as i can for someday you might just decide to come home i love you still and i want you to know i'm still here still though you broke my heart still though you're far apart i love you still
79,Country,Osborne Brothers,Rocky Top,wish that i was on ol' rocky top down in the tennessee hills ain't no smoggy smoke on rocky top ain't no telephone bills once i had a girl on rocky top half bear other half cat wild as a mink but sweet as soda pop i still dream about that rocky top you'll always be home sweet home to me good ol' rocky top rocky top tennessee rocky top tennessee once two strangers climbed ol' rocky top lookin' for a moonshine still strangers ain't come down from rocky top reckon they never will corn won't grow at all on rocky top dirt's too rocky by far that's why all the folks on rocky top get their corn from a jar rocky top you'll always be home sweet home to me good ol' rocky top rocky top tennessee rocky top tennessee i've had years of cramped up city life trapped like a duck in a pen all i know is it's a pity life can't be simple again rocky top you'll always be home sweet home to me good ol' rocky top rocky top tennessee rocky top tennessee rocky top tennessee
80,Country,The Statler Brothers,Flowers On The Wall,"the statler brothers miscellaneous flowers on the wall flowers on the wall artists the statler brothers peak billboard position # 4 in 1966 words and music by lewis dewitt i keep hearin' you're concerned about my happiness but all that thought you're givin' me is conscience i guess if i was walkin' in your shoes i wouldn't worry none while you 'n' your friends are worried about me i'm havin' lots of fun  countin' flowers on the wall that don't bother me at all playin' solitaire till dawn with a deck of fiftyone smokin' cigarettes and watchin' captain kangaroo now don't tell me i've nothin' to do last night i dressed in tails pretended i was on the town as long as i can dream it's hard to slow this swinger down so please don't give a thought to me i'm really doin' fine you can always find me here i'm havin' quite a time  it's good to see you i must go i know i look a fright anyway my eyes are not accustomed to this light and my shoes are not accustomed to this hard concrete so i must go back to my room and make my day complete  don't tell me i've nothin' to do transcribed by ronald e hontz <a class""__cf_email__"" datacfemail""34465b5a5c5b5a404e74435b4658505a51401a5540401a5a5140"" href""/cdncgi/l/emailprotection"">emailÂ protected</a>"
81,Country,Harry McClintock,Big Rock Candy Mountain,"one evening as the sun went down and the jungle fire was burning down the track came a hobo hiking and he said ""boys i'm not turningâ€ â€œi'm headed for a land that's far away besides the crystal fountains so come with me we'll go and see the big rock candy mountainsâ€ in the big rock candy mountains there's a land that's fair and bright where the handouts grow on bushes and you sleep out every night where the boxcars all are empty and the sun shines every day and the birds and the bees and the cigarette trees the lemonade springs where the bluebird sings in the big rock candy mountains in the big rock candy mountains all the cops have wooden legs and the bulldogs all have rubber teeth and the hens lay softboiled eggs the farmers' trees are full of fruit and the barns are full of hay oh i'm bound to go where there ain't no snow where the rain don't fall the winds don't blow in the big rock candy mountains in the big rock candy mountains you never change your socks and the little streams of alcohol come trickling down the rocks the brakemen have to tip their hats and the railway bulls are blind there's a lake of stew and of whiskey too you can paddle all around it in a big canoe in the big rock candy mountains in the big rock candy mountains the jails are made of tin and you can walk right out again as soon as you are in there ain't no shorthandled shovels no axes saws nor picks i'm goin' to stay where you sleep all day where they hung the jerk that invented work in the big rock candy mountains i'll see you all this coming fall in the big rock candy mountains"
82,Country,John Michael Montgomery,I Swear,i see the questions in your eyes i know what's weighing on your mind but you can be sure i know my part 'cause i'll stand beside you through the years you'll only cry those happy tears and though i'll make mistakes i'll never break your heart i swear by the moon and stars in the sky i'll be there i swear like the shadow that's by your side i'll be there for better or worse till death do us part i'll love you with every beat of my heart i swear i'll give you everything i can i'll build your dreams with these two hands we'll hang some memories on the wall and when there's silver in your hair won't have to ask if i still care 'cause as time turns the page my love won't age at all i swear by the moon and stars in the sky i'll be there i swear like the shadow that's by your side i'll be there for better or worse till death do us part i'll love you with every beat of my heart i swear i swear by the moon and stars in the sky i'll be there i swear like the shadow that's by your side i'll be there for better or worse till death do us part i'll love you with every beat of my heart i swear i swear
83,Country,Kenny Chesney,How Forever Feels,big orange ball sinkin' in the water toes in the sand couldn't get much hotter little umbrella shaped margaritas coconut oil tan senoritas oh now i know how jimmy buffet feels hands on the wheel cruisin' down the interstate gas pedal sticks carries my car away i was going as fast as a rambler goes i could feel the speed from my head to my toes oh now i know how richard petty feels well i've been around the block a time or two done almost everything a boy can do i've done some livin' yeah i've had fun but there is one thing that i haven't done saved two months bought a little diamond tonight's the night feels like perfect timin' down on one knee on momma's front steps man i'm gonna die if she really says yes i wanna know how forever feels well i've been around the block a time or two done almost everything a boy can do i've done some livin' yeah i've had fun but there is one thing that i haven't done i wanna know how forever feels hey i wanna know how forever feels girl i wanna know how forever feels
84,Country,Dolly Parton,Jolene,dolly parton greatest hits jolene jolene jolene jolene jolene i'm begging of you please don't take my man jolene jolene jolene jolene please don't take him just because you can your beauty is beyond compare with flaming locks of auburn hair with ivory skin and eyes of emerald green your smile is like a breath of spring your voice is soft like summer rain and i cannot compete with you jolene he talks about you in his sleep there's nothing i can do to keep from crying when he calls your name jolene and i can easily understand how you could easily take my man but you don't know what he means to me jolene jolene jolene jolene jolene i'm begging of you please don't take my man jolene jolene jolene jolene please don't take him just because you can you could have your choice of men but i could never love again he's the only one for me jolene i had to have this talk with you my happiness depends on you and whatever you decide to do jolene jolene jolene jolene jolene i'm begging of you please don't take my man jolene jolene jolene jolene please don't take him even though you can jolene jolene
85,Country,Hank Locklin,Please Help Me I'm Falling,please help me i'm falling in love with you close the door to temptation don't let me walk through turn away from me darling i'm begging you to please help me i'm falling in love with you i belong to another whose arms have grown cold but i promised forever to have and to hold i can never be free dear but when i'm with you i know that i'm losing the will to be true please help me i'm falling and that would be sin close the door to temptation don't let me walk in for i mustn't want you but darling i do please help me i'm falling in love with you
